App Ideas,Validated or Not,Reference,TikTok Account Link
AI Essay Undetector,Validated,NaturalWrite.com and Undetectable.ai proven market,
AI Roast Generator,Not Validated,Similar to roast-my-resume but broader,
Face Age Guesser,Validated,How-old.net Microsoft tool went viral,
AI Assignment Checker,Not Validated,Similar to Turnitin/Grammarly AI detection,
Text Chemistry Analyzer,Not Validated,Original concept for relationship insights,
Study Schedule Optimizer,Not Validated,Original concept for student productivity,
Voice Confidence Scorer,Not Validated,Original concept for presentation/dating confidence,
Meeting TLDR Generator,Not Validated,Similar to Otter.ai but focused on summaries,